{
  "$schema": "http://json-schema.org/draft-07/schema#",
  "$id": "https://velocitycareerlabs.io/w3c-vc.schema.json",
  "type": "object",
  "title": "w3c-vc",
  "description": "An w3c vc schema",
  "additionalProperties": true,
  "properties": {
    "@context": {
      "type": "array",
      "items": {
        "type": "string"
      },
      "description": "The JSON-LD context of the credential. @context is defaulted based on the VN credential metadata for the type chosen below"
    },
    "type": {
      "type": "array",
      "description": "The JSON-LD type of the credential.",
      "items": {
        "type": "string"
      },
      "minItems": 1
    },
    "credentialSubject": {
      "type": "object",
      "description": "Contains all the claims of the credential",
      "additionalProperties": true
    },
    "validUntil": {
      "type": "string",
      "format": "date-time"
    },
    "validFrom": {
      "type": "string",
      "format": "date-time"
    },
    "name": {
      "type": "string"
    },
    "issuer": {
      "type": "object",
      "additionalProperties": true,
      "properties": {
        "type": {
          "anyOf": [
            {
              "type": "string",
              "description": "the type of the issuer property"
            },
            {
              "type": "array",
              "items": { "type": "string" }
            }
          ]
        },
        "id": {
          "type": "string",
          "description": "The issuer id."
        },
        "name": {
          "type": "string",
          "description": "The name of brand"
        },
        "image": {
          "type": "string",
          "description": "The uri to image"
        }
      }
    },
    "replaces": {
      "type": "array",
      "items": {
        "$ref": "https://velocitycareerlabs.io/new-offer-related-resource.schema.json#"
      }
    },
    "relatedResource": {
      "type": "array",
      "items": {
        "$ref": "https://velocitycareerlabs.io/new-offer-related-resource.schema.json#"
      }
    },
    "description": {
      "type": "string"
    },
    "image": {
      "type": "string",
      "format": "uri"
    },
    "awardedDate": {
      "type": "string",
      "format": "date-time"
    },
    "endorsement": {
      "type": "array",
      "items": {
        "type": "object",
        "additionalProperties": true
      }
    },
    "endorsementJwt": {
      "type": "array",
      "items": {
        "type": "string"
      }
    },
    "evidence": {
      "type": "array",
      "items": {
        "type": "object",
        "additionalProperties": true
      }
    },
    "credentialSchema": {
      "oneOf": [{
        "type": "object",
        "properties": {
          "id": {
            "type": "string",
            "format": "uri"
          },
          "type": {
            "type": "string"
          }
        }
      }, {
        "type": "array",
        "items": {
          "type": "object",
          "properties": {
            "id": {
              "type": "string",
              "format": "uri"
            },
            "type": {
              "type": "string"
            }
          }
        }
      }]
    },
    "credentialStatus": {
      "type": "object",
      "properties": {
        "id": {
          "type": "string",
          "format": "uri"
        },
        "type": {
          "type": "string"
        }
      }
    },
    "refreshService": {
      "type": "object",
      "properties": {
        "id": {
          "type": "string",
          "format": "uri"
        },
        "type": {
          "type": "string"
        }
      }
    },
    "termsOfUrl": {
      "type": "object",
      "properties": {
        "id": {
          "type": "string"
        },
        "type": {
          "type": "string"
        }
      }
    },
    "expirationDate": {
      "type": "string",
      "format": "date-time",
      "deprecated": true
    },
    "linkedCredentials": {
      "type": "array",
      "items": {
        "type": "object",
        "properties": {
          "linkedCredentialId": {
            "type": "string"
          },
          "linkType": {
            "type": "string",
            "enum": [
              "REPLACE"
            ]
          }
        },
        "required": [
          "linkedCredentialId",
          "linkType"
        ]
      },
      "deprecated": true
    }
  },
  "required": [
    "type",
    "credentialSubject"
  ]
}
