{
  "@context": [
    "https://www.w3.org/ns/credentials/v2",
    "https://purl.imsglobal.org/spec/ob/v3p0/context-3.1.0.json"
  ],
  "type": ["OpenBadgeCredential", "AchievementCredential"],
  "credentialSubject": {
    "achievement": {
      "type": "Achievement",
      "id": "https://velocitynetwork.foundation/credentials/openbadgecredential-5",
      "name": "Wallet Passed VN Plugfest 2024",
      "description": "This wallet can display this Open Badge 3.0",
      "criteria": {
        "narrative": "The first cohort of the JFF Plugfest 1 in May/June of 2021 collaborated to push interoperability of VCs in education forward."
      },
      "image": {
        "id": "https://w3c-ccg.github.io/vc-ed/plugfest-1-2022/images/plugfest-1-badge-image.png",
        "type": "Image"
      }
    }
  },
  "name": "Wallet VN Plugfest 2024",
  "description": "Wallets are great when they interoperate",
  "image": "https://example.org/image.jpg",
  "awardedDate": "2024-10-01T09:00:00.001Z",
  "endorsement": [
    {
      "@context": [
        "https://www.w3.org/ns/credentials/v2",
        "https://purl.imsglobal.org/spec/ob/v3p0/context-3.1.0.json"
      ],
      "type": ["VerifiableCredential", "EndorsementCredential"]
    }
  ],
  "endorsementJwt": [
    "eyJ0eXAiOiJKV1QiLCJhbGciOiJFUzI1NksifQ.eyJuYW1lIjoiZW5kb3JzZW1lbnQiLCJpYXQiOjE3MjU0MjgwODJ9.2SSU_WYSmXobZ3xLCzQYzmciFL3IAuAl9lfJPYM1JSbwa4itJNP9CaphUhimqaLiSmS5fZYtcdLDlEGWpMghyw"
  ],
  "evidence": [
    {
      "id": "https://example.com/evidence-3219839112",
      "type": ["Evidence"],
      "narrative": "blah blah blah",
      "name": "Big Evidence",
      "audience": "Everybody"
    }
  ],
  "credentialSchema": {
    "type": "1EdTechJsonSchemaValidator2019",
    "id": "http://example.com/schema.json"
  },
  "credentialStatus": {
    "type": "1EdTechRevocationList",
    "id": "https://example.edu/revocations/24"
  },
  "refreshService": {
    "type": "1EdTechCredentialRefresh",
    "id": "http://agent.example.com/refresh-service"
  }
}
